{
  "$schema": "./brand-token-source.schema.json",
  "schemaVersion": 1,
  "sourceId": "menq.design.token-source.brand-expression.v1",
  "decision": "D-027",
  "status": "Approved — Implementing",
  "canonicalLanguages": [
    "hy",
    "en"
  ],
  "generatedOutputsAreCanonical": false,
  "modes": [
    "light",
    "dark"
  ],
  "fonts": [
    {
      "family": "Inter",
      "file": "fonts/Inter-Latin-Variable.woff2",
      "weight": "100 900",
      "style": "normal"
    },
    {
      "family": "Inter Cyrillic",
      "file": "fonts/Inter-Cyrillic-Variable.woff2",
      "weight": "100 900",
      "style": "normal"
    },
    {
      "family": "Noto Sans Armenian",
      "file": "fonts/NotoSansArmenian-Variable.woff2",
      "weight": "100 900",
      "style": "normal"
    },
    {
      "family": "JetBrains Mono",
      "file": "fonts/JetBrainsMono-Latin-Variable.woff2",
      "weight": "100 800",
      "style": "normal"
    },
    {
      "family": "JetBrains Mono Cyrillic",
      "file": "fonts/JetBrainsMono-Cyrillic-Variable.woff2",
      "weight": "100 800",
      "style": "normal"
    }
  ],
  "typeStyles": [
    {
      "name": "hero",
      "fontSize": "3.75rem",
      "lineHeight": 1.1,
      "fontWeight": 700,
      "letterSpacing": "-0.02em",
      "family": "display",
      "group": "Display",
      "description": {
        "hy": "Landing-ի գլխավոր վերնագիր։",
        "en": "Landing hero headline (font-size-6xl)."
      }
    },
    {
      "name": "h1",
      "fontSize": "3rem",
      "lineHeight": 1.1,
      "fontWeight": 700,
      "letterSpacing": "-0.02em",
      "family": "display",
      "group": "Display",
      "description": {
        "hy": "Մարքեթինգային էջի վերնագիր։",
        "en": "Page title on marketing pages (5xl)."
      }
    },
    {
      "name": "h2",
      "fontSize": "2.25rem",
      "lineHeight": 1.1,
      "fontWeight": 700,
      "letterSpacing": "-0.02em",
      "family": "display",
      "group": "Display",
      "description": {
        "hy": "Բաժնի վերնագիր։",
        "en": "Section headings (4xl)."
      }
    },
    {
      "name": "h3",
      "fontSize": "1.5rem",
      "lineHeight": 1.25,
      "fontWeight": 600,
      "family": "display",
      "group": "Display",
      "description": {
        "hy": "Քարտի և հավելվածի էջի վերնագիր։",
        "en": "Card and app page titles (2xl)."
      }
    },
    {
      "name": "stat",
      "fontSize": "1.875rem",
      "lineHeight": 1.1,
      "fontWeight": 700,
      "letterSpacing": "-0.02em",
      "family": "display",
      "group": "Display",
      "description": {
        "hy": "KPI թվեր։",
        "en": "KPI numbers, tabular figures (3xl)."
      }
    },
    {
      "name": "title",
      "fontSize": "1.125rem",
      "lineHeight": 1.25,
      "fontWeight": 600,
      "family": "sans",
      "group": "Text",
      "description": {
        "hy": "Պանելի, մոդալի, drawer-ի վերնագիր։",
        "en": "Panel, modal and drawer titles (lg)."
      }
    },
    {
      "name": "body-lg",
      "fontSize": "1.125rem",
      "lineHeight": 1.7,
      "fontWeight": 400,
      "family": "sans",
      "group": "Text",
      "description": {
        "hy": "Ներածական պարբերություն։",
        "en": "Lead paragraphs (lg, relaxed)."
      }
    },
    {
      "name": "body",
      "fontSize": "1rem",
      "lineHeight": 1.5,
      "fontWeight": 400,
      "family": "sans",
      "group": "Text",
      "description": {
        "hy": "Հիմնական տեքստ։",
        "en": "Default body (md)."
      }
    },
    {
      "name": "body-sm",
      "fontSize": "0.875rem",
      "lineHeight": 1.5,
      "fontWeight": 400,
      "family": "sans",
      "group": "Text",
      "description": {
        "hy": "Հավելվածի UI տեքստ, աղյուսակներ, կոճակներ։",
        "en": "App UI text, table cells, buttons (sm)."
      }
    },
    {
      "name": "caption",
      "fontSize": "0.75rem",
      "lineHeight": 1.5,
      "fontWeight": 500,
      "family": "sans",
      "group": "Text",
      "description": {
        "hy": "Meta, ժամեր, badge-եր։",
        "en": "Meta, timestamps, badges (xs)."
      }
    },
    {
      "name": "overline",
      "fontSize": "0.7rem",
      "lineHeight": 1.5,
      "fontWeight": 600,
      "letterSpacing": "0.12em",
      "family": "sans",
      "group": "Text",
      "description": {
        "hy": "Մեծատառ kicker-ներ և label-ներ։",
        "en": "Uppercase kickers and field labels (2xs, wider)."
      }
    },
    {
      "name": "code",
      "fontSize": "0.75rem",
      "lineHeight": 1.6,
      "fontWeight": 400,
      "family": "mono",
      "group": "Code",
      "description": {
        "hy": "Scope-եր, ID-ներ, shortcut-ներ։",
        "en": "Agent scopes, IDs, shortcuts."
      }
    }
  ],
  "tokens": [
    {
      "id": "menq.design.token.reference.brand.color.neutral.0",
      "cssName": "neutral-0",
      "layer": "Reference",
      "type": "color",
      "description": {
        "hy": "Պրիմիտիվ գույն neutral-0։ Կոմպոնենտներում ուղղակի չի օգտագործվում։",
        "en": "Primitive colour neutral-0. Never used directly in components."
      },
      "ownerId": "owner.menq",
      "lifecycle": "Draft",
      "value": "#ffffff"
    },
    {
      "id": "menq.design.token.reference.brand.color.neutral.50",
      "cssName": "neutral-50",
      "layer": "Reference",
      "type": "color",
      "description": {
        "hy": "Պրիմիտիվ գույն neutral-50։ Կոմպոնենտներում ուղղակի չի օգտագործվում։",
        "en": "Primitive colour neutral-50. Never used directly in components."
      },
      "ownerId": "owner.menq",
      "lifecycle": "Draft",
      "value": "#f8fafc"
    },
    {
      "id": "menq.design.token.reference.brand.color.neutral.100",
      "cssName": "neutral-100",
      "layer": "Reference",
      "type": "color",
      "description": {
        "hy": "Պրիմիտիվ գույն neutral-100։ Կոմպոնենտներում ուղղակի չի օգտագործվում։",
        "en": "Primitive colour neutral-100. Never used directly in components."
      },
      "ownerId": "owner.menq",
      "lifecycle": "Draft",
      "value": "#f1f5f9"
    },
    {
      "id": "menq.design.token.reference.brand.color.neutral.200",
      "cssName": "neutral-200",
      "layer": "Reference",
      "type": "color",
      "description": {
        "hy": "Պրիմիտիվ գույն neutral-200։ Կոմպոնենտներում ուղղակի չի օգտագործվում։",
        "en": "Primitive colour neutral-200. Never used directly in components."
      },
      "ownerId": "owner.menq",
      "lifecycle": "Draft",
      "value": "#e2e8f0"
    },
    {
      "id": "menq.design.token.reference.brand.color.neutral.300",
      "cssName": "neutral-300",
      "layer": "Reference",
      "type": "color",
      "description": {
        "hy": "Պրիմիտիվ գույն neutral-300։ Կոմպոնենտներում ուղղակի չի օգտագործվում։",
        "en": "Primitive colour neutral-300. Never used directly in components."
      },
      "ownerId": "owner.menq",
      "lifecycle": "Draft",
      "value": "#cbd5e1"
    },
    {
      "id": "menq.design.token.reference.brand.color.neutral.400",
      "cssName": "neutral-400",
      "layer": "Reference",
      "type": "color",
      "description": {
        "hy": "Պրիմիտիվ գույն neutral-400։ Կոմպոնենտներում ուղղակի չի օգտագործվում։",
        "en": "Primitive colour neutral-400. Never used directly in components."
      },
      "ownerId": "owner.menq",
      "lifecycle": "Draft",
      "value": "#94a3b8"
    },
    {
      "id": "menq.design.token.reference.brand.color.neutral.500",
      "cssName": "neutral-500",
      "layer": "Reference",
      "type": "color",
      "description": {
        "hy": "Պրիմիտիվ գույն neutral-500։ Կոմպոնենտներում ուղղակի չի օգտագործվում։",
        "en": "Primitive colour neutral-500. Never used directly in components."
      },
      "ownerId": "owner.menq",
      "lifecycle": "Draft",
      "value": "#64748b"
    },
    {
      "id": "menq.design.token.reference.brand.color.neutral.600",
      "cssName": "neutral-600",
      "layer": "Reference",
      "type": "color",
      "description": {
        "hy": "Պրիմիտիվ գույն neutral-600։ Կոմպոնենտներում ուղղակի չի օգտագործվում։",
        "en": "Primitive colour neutral-600. Never used directly in components."
      },
      "ownerId": "owner.menq",
      "lifecycle": "Draft",
      "value": "#475569"
    },
    {
      "id": "menq.design.token.reference.brand.color.neutral.700",
      "cssName": "neutral-700",
      "layer": "Reference",
      "type": "color",
      "description": {
        "hy": "Պրիմիտիվ գույն neutral-700։ Կոմպոնենտներում ուղղակի չի օգտագործվում։",
        "en": "Primitive colour neutral-700. Never used directly in components."
      },
      "ownerId": "owner.menq",
      "lifecycle": "Draft",
      "value": "#334155"
    },
    {
      "id": "menq.design.token.reference.brand.color.neutral.800",
      "cssName": "neutral-800",
      "layer": "Reference",
      "type": "color",
      "description": {
        "hy": "Պրիմիտիվ գույն neutral-800։ Կոմպոնենտներում ուղղակի չի օգտագործվում։",
        "en": "Primitive colour neutral-800. Never used directly in components."
      },
      "ownerId": "owner.menq",
      "lifecycle": "Draft",
      "value": "#1e293b"
    },
    {
      "id": "menq.design.token.reference.brand.color.neutral.900",
      "cssName": "neutral-900",
      "layer": "Reference",
      "type": "color",
      "description": {
        "hy": "Պրիմիտիվ գույն neutral-900։ Կոմպոնենտներում ուղղակի չի օգտագործվում։",
        "en": "Primitive colour neutral-900. Never used directly in components."
      },
      "ownerId": "owner.menq",
      "lifecycle": "Draft",
      "value": "#0f172a"
    },
    {
      "id": "menq.design.token.reference.brand.color.neutral.950",
      "cssName": "neutral-950",
      "layer": "Reference",
      "type": "color",
      "description": {
        "hy": "Պրիմիտիվ գույն neutral-950։ Կոմպոնենտներում ուղղակի չի օգտագործվում։",